number,value,datetime_start,datetime_complete,duration,params_alpha,params_base_ch,params_batch_size,params_bottleneck,params_dropout,params_latent_ch,params_latent_dim,params_lr,system_attrs_tpe:relative_params:0,state
0,0.5615778341889381,2026-10-04 05:56:28.330040,2026-10-04 05:58:56.864902,0 days 00:02:28.534862,0.8186326600082204,64,32,conv,0.18033450352296262,4.0,,0.0007106591851092234,,COMPLETE
1,0.5179177820682526,2026-10-04 05:58:56.884571,2026-10-04 05:59:39.063977,0 days 00:00:42.179406,0.8533291826268561,16,32,conv,0.13682099526511077,16.0,,0.0006044543365247595,,COMPLETE
2,0.48617377132177353,2026-10-04 05:59:39.081600,2026-10-04 06:01:29.024168,0 days 00:01:49.942568,0.7228296095500716,48,64,conv,0.036611470453433645,8.0,,0.00034847597967739357,,COMPLETE
3,0.7195303291082382,2026-10-04 06:01:29.040354,2026-10-04 06:01:40.967852,0 days 00:00:11.927498,0.5881922880886153,16,64,conv,0.02654775061557585,16.0,,0.00105640764164036,,PRUNED
4,0.7877881526947021,2026-10-04 06:01:40.982992,2026-10-04 06:02:00.919929,0 days 00:00:19.936937,0.8669576428046754,32,128,conv,0.0016566351370807197,4.0,,0.0005728695840313613,,PRUNED
5,0.5738614350557327,2026-10-04 06:02:00.931950,2026-10-04 06:03:07.487590,0 days 00:01:06.555640,0.7124967163228771,48,32,conv,0.26616382277289796,16.0,,0.0021888937469133466,,PRUNED
6,0.4774000346660614,2026-10-04 06:03:07.499643,2026-10-04 06:04:16.043862,0 days 00:01:08.544219,0.6121815031169937,32,32,conv,0.2722699421778279,16.0,,0.0009996640726638705,,COMPLETE
7,1.1003543138504028,2026-10-04 06:04:16.060838,2026-10-04 06:04:51.508173,0 days 00:00:35.447335,0.9032410849655719,48,128,linear,0.24223204654921876,,1024.0,0.0025516370943178554,,PRUNED
8,0.6682812720537186,2026-10-04 06:04:51.521342,2026-10-04 06:05:25.432460,0 days 00:00:33.911118,0.81635853150283,48,32,conv,0.1556371865230098,4.0,,0.0003048410053590859,,PRUNED
9,0.8277793824672699,2026-10-04 06:05:25.446129,2026-10-04 06:05:59.236045,0 days 00:00:33.789916,0.7202537421249033,48,64,linear,0.04346846162736693,,256.0,0.0005780451332842859,,PRUNED
10,0.44032205641269684,2026-10-04 06:05:59.248668,2026-10-04 06:07:07.659221,0 days 00:01:08.410553,0.5662463688599269,32,32,conv,0.11526581787119378,32.0,,0.0015380337471164356,"{""alpha"": 0.5662463688599269, ""base_ch"": 32, ""batch_size"": 32, ""bottleneck"": ""conv"", ""dropout"": 0.11526581787119378, ""lr"": 0.0015380337471164356}",COMPLETE
11,0.5556540936231613,2026-10-04 06:07:07.676378,2026-10-04 06:07:48.847954,0 days 00:00:41.171576,0.6652243486123547,32,32,conv,0.1705170189786942,32.0,,0.0017789440569363718,"{""alpha"": 0.6652243486123547, ""base_ch"": 32, ""batch_size"": 32, ""bottleneck"": ""conv"", ""dropout"": 0.1705170189786942, ""lr"": 0.0017789440569363718}",PRUNED
12,0.5623089671134949,2026-10-04 06:07:48.860098,2026-10-04 06:08:09.904727,0 days 00:00:21.044629,0.6331846318932259,16,32,conv,0.2578695826416797,32.0,,0.000870485793094218,"{""alpha"": 0.6331846318932259, ""base_ch"": 16, ""batch_size"": 32, ""bottleneck"": ""conv"", ""dropout"": 0.2578695826416797, ""lr"": 0.000870485793094218}",PRUNED
13,0.4154086783528328,2026-10-04 06:08:09.917803,2026-10-04 06:10:01.291440,0 days 00:01:51.373637,0.5488201395303574,48,32,conv,0.10084314710037118,32.0,,0.0009274604617451832,"{""alpha"": 0.5488201395303574, ""base_ch"": 48, ""batch_size"": 32, ""bottleneck"": ""conv"", ""dropout"": 0.10084314710037118, ""lr"": 0.0009274604617451832}",COMPLETE
14,0.534175381064415,2026-10-04 06:10:01.309065,2026-10-04 06:10:42.343083,0 days 00:00:41.034018,0.5570017784062707,32,32,conv,0.11100943819660868,32.0,,0.0028053898695169074,"{""alpha"": 0.5570017784062707, ""base_ch"": 32, ""batch_size"": 32, ""bottleneck"": ""conv"", ""dropout"": 0.11100943819660868, ""lr"": 0.0028053898695169074}",PRUNED
15,0.4143088236451149,2026-10-04 06:10:42.356909,2026-10-04 06:12:34.308011,0 days 00:01:51.951102,0.5136999065389088,48,32,conv,0.10058653627072628,32.0,,0.0007739720850176257,"{""alpha"": 0.5136999065389088, ""base_ch"": 48, ""batch_size"": 32, ""bottleneck"": ""conv"", ""dropout"": 0.10058653627072628, ""lr"": 0.0007739720850176257}",COMPLETE
16,0.4471118822693825,2026-10-04 06:12:34.327243,2026-10-04 06:14:25.977600,0 days 00:01:51.650357,0.6251800358670697,48,32,conv,0.04376913255903388,32.0,,0.0013667614251117758,"{""alpha"": 0.6251800358670697, ""base_ch"": 48, ""batch_size"": 32, ""bottleneck"": ""conv"", ""dropout"": 0.04376913255903388, ""lr"": 0.0013667614251117758}",COMPLETE
17,0.4754691869020462,2026-10-04 06:14:25.992242,2026-10-04 06:15:54.879257,0 days 00:01:28.887015,0.5922321697644082,48,32,conv,0.11228936656724045,8.0,,0.0005211439048921518,"{""alpha"": 0.5922321697644082, ""base_ch"": 48, ""batch_size"": 32, ""bottleneck"": ""conv"", ""dropout"": 0.11228936656724045, ""lr"": 0.0005211439048921518}",PRUNED
18,0.42224325239658356,2026-10-04 06:15:54.892451,2026-10-04 06:17:46.385674,0 days 00:01:51.493223,0.5188256399962782,48,32,conv,0.1724359878292619,32.0,,0.0008593205785703426,"{""alpha"": 0.5188256399962782, ""base_ch"": 48, ""batch_size"": 32, ""bottleneck"": ""conv"", ""dropout"": 0.1724359878292619, ""lr"": 0.0008593205785703426}",COMPLETE
19,0.908156543970108,2026-10-04 06:17:46.400383,2026-10-04 06:18:18.980459,0 days 00:00:32.580076,0.5096634009954937,48,128,linear,0.11535973317151442,,128.0,0.0005821351612707562,"{""alpha"": 0.5096634009954937, ""base_ch"": 48, ""batch_size"": 128, ""bottleneck"": ""linear"", ""dropout"": 0.11535973317151442, ""lr"": 0.0005821351612707562}",PRUNED
20,0.803928479552269,2026-10-04 06:18:18.995232,2026-10-04 06:18:56.036588,0 days 00:00:37.041356,0.5208268754118099,48,32,linear,0.0022708514071392433,,512.0,0.0008348791240519953,"{""alpha"": 0.5208268754118099, ""base_ch"": 48, ""batch_size"": 32, ""bottleneck"": ""linear"", ""dropout"": 0.0022708514071392433, ""lr"": 0.0008348791240519953}",PRUNED
21,0.43421901017427444,2026-10-04 06:18:56.048985,2026-10-04 06:20:47.500851,0 days 00:01:51.451866,0.5711759469958089,48,32,conv,0.225344935730453,32.0,,0.0006181949717380203,"{""alpha"": 0.5711759469958089, ""base_ch"": 48, ""batch_size"": 32, ""bottleneck"": ""conv"", ""dropout"": 0.225344935730453, ""lr"": 0.0006181949717380203}",COMPLETE
22,0.5537209212779999,2026-10-04 06:20:47.514852,2026-10-04 06:21:43.378638,0 days 00:00:55.863786,0.501268124221434,48,32,conv,0.12578145123055642,32.0,,0.0006704840394191084,"{""alpha"": 0.501268124221434, ""base_ch"": 48, ""batch_size"": 32, ""bottleneck"": ""conv"", ""dropout"": 0.12578145123055642, ""lr"": 0.0006704840394191084}",PRUNED
23,0.8193804621696472,2026-10-04 06:21:43.391590,2026-10-04 06:22:15.934464,0 days 00:00:32.542874,0.5505568072581533,48,128,conv,0.14584569263651195,32.0,,0.0009967451107808299,"{""alpha"": 0.5505568072581533, ""base_ch"": 48, ""batch_size"": 128, ""bottleneck"": ""conv"", ""dropout"": 0.14584569263651195, ""lr"": 0.0009967451107808299}",PRUNED
24,0.6363631039857864,2026-10-04 06:22:15.947443,2026-10-04 06:22:49.305853,0 days 00:00:33.358410,0.5454376437969982,48,32,conv,0.0686034433089016,32.0,,0.0012877752831218269,"{""alpha"": 0.5454376437969982, ""base_ch"": 48, ""batch_size"": 32, ""bottleneck"": ""conv"", ""dropout"": 0.0686034433089016, ""lr"": 0.0012877752831218269}",PRUNED
25,0.6199226081371307,2026-10-04 06:22:49.317779,2026-10-04 06:23:09.896752,0 days 00:00:20.578973,0.5839517458850839,32,32,conv,0.052953975095878195,32.0,,0.0005151764646839094,"{""alpha"": 0.5839517458850839, ""base_ch"": 32, ""batch_size"": 32, ""bottleneck"": ""conv"", ""dropout"": 0.052953975095878195, ""lr"": 0.0005151764646839094}",PRUNED
26,0.5075234398245811,2026-10-04 06:23:09.912440,2026-10-04 06:24:16.707781,0 days 00:01:06.795341,0.620223790393281,48,32,conv,0.18142536883203303,8.0,,0.0009210620932870983,"{""alpha"": 0.620223790393281, ""base_ch"": 48, ""batch_size"": 32, ""bottleneck"": ""conv"", ""dropout"": 0.18142536883203303, ""lr"": 0.0009210620932870983}",PRUNED
27,0.425199419260025,2026-10-04 06:24:16.722811,2026-10-04 06:26:07.933042,0 days 00:01:51.210231,0.672999847780919,48,32,conv,0.1139233063976712,32.0,,0.0006408358693211139,"{""alpha"": 0.672999847780919, ""base_ch"": 48, ""batch_size"": 32, ""bottleneck"": ""conv"", ""dropout"": 0.1139233063976712, ""lr"": 0.0006408358693211139}",COMPLETE
28,0.4240604192018509,2026-10-04 06:26:07.947344,2026-10-04 06:27:59.588148,0 days 00:01:51.640804,0.5111094115156696,48,32,conv,0.19437931867656338,32.0,,0.0010404300263074137,"{""alpha"": 0.5111094115156696, ""base_ch"": 48, ""batch_size"": 32, ""bottleneck"": ""conv"", ""dropout"": 0.19437931867656338, ""lr"": 0.0010404300263074137}",COMPLETE
29,0.42027006298303604,2026-10-04 06:27:59.603195,2026-10-04 06:29:50.891049,0 days 00:01:51.287854,0.6377223872358097,48,32,conv,0.1161590383704662,32.0,,0.000861326509199121,"{""alpha"": 0.6377223872358097, ""base_ch"": 48, ""batch_size"": 32, ""bottleneck"": ""conv"", ""dropout"": 0.1161590383704662, ""lr"": 0.000861326509199121}",COMPLETE
