number,value,datetime_start,datetime_complete,duration,params_batch_size,params_channels,params_dropout,params_lr,params_weight_decay,system_attrs_tpe:relative_params:0,state
0,0.9904851545243846,2026-10-04 06:57:58.010024,2026-10-04 06:58:18.259364,0 days 00:00:20.249340,32,small,0.4330880728874676,0.0008605034792033113,0.00025378155082656634,,COMPLETE
1,0.9881178315186596,2026-10-04 06:58:18.278495,2026-10-04 06:58:36.179690,0 days 00:00:17.901195,64,small,0.15212112147976886,0.0021992715112745254,0.0001256104370001356,,COMPLETE
2,0.9874411994318406,2026-10-04 06:58:36.193540,2026-10-04 06:59:24.099043,0 days 00:00:47.905503,64,large,0.3925879806965068,0.0010113296398644534,6.290644294586145e-06,,COMPLETE
3,0.597674367356074,2026-10-04 06:59:24.117173,2026-10-04 06:59:38.129533,0 days 00:00:14.012360,128,large,0.4828160165372797,0.001274787981335257,0.0017123375973163992,,PRUNED
4,0.9288860385094091,2026-10-04 06:59:38.141848,2026-10-04 06:59:46.244509,0 days 00:00:08.102661,64,medium,0.45466020103939103,0.000706827125296226,1.0842262717330169e-05,,PRUNED
5,0.5871854132676294,2026-10-04 06:59:46.256537,2026-10-04 06:59:54.341456,0 days 00:00:08.084919,128,medium,0.46974947078209456,0.0019347429795778545,0.003795853142670641,,PRUNED
6,0.6912173069587606,2026-10-04 06:59:54.353161,2026-10-04 07:00:09.253931,0 days 00:00:14.900770,32,large,0.13567451588694796,0.0016131122759154171,0.0020651425578959264,,PRUNED
7,0.7986452921407874,2026-10-04 07:00:09.266139,2026-10-04 07:00:23.955678,0 days 00:00:14.689539,64,large,0.3861223846483287,0.0008185022184691307,6.235377135673162e-06,,PRUNED
8,0.9778715156161328,2026-10-04 07:00:23.967297,2026-10-04 07:00:36.885493,0 days 00:00:12.918196,32,small,0.05793452976256486,0.00030469718828990714,0.0028340904295147754,,PRUNED
9,0.9223912483321931,2026-10-04 07:00:36.897470,2026-10-04 07:00:45.389467,0 days 00:00:08.491997,32,medium,0.44360637128816327,0.0017325959369767984,7.742116473996259e-05,,PRUNED
10,0.9516637864397545,2026-10-04 07:00:45.401384,2026-10-04 07:00:54.599858,0 days 00:00:09.198474,32,small,0.3405733823357181,0.0004710345944324448,2.9459940256348706e-05,"{""batch_size"": 32, ""channels"": ""small"", ""dropout"": 0.3405733823357181, ""lr"": 0.0004710345944324448, ""weight_decay"": 2.9459940256348706e-05}",PRUNED
11,0.9175534138350374,2026-10-04 07:00:54.612202,2026-10-04 07:01:03.152676,0 days 00:00:08.540474,64,small,0.08882160295553455,0.002042528402131828,6.067791560696629e-05,"{""batch_size"": 64, ""channels"": ""small"", ""dropout"": 0.08882160295553455, ""lr"": 0.002042528402131828, ""weight_decay"": 6.067791560696629e-05}",PRUNED
12,0.8971314257176299,2026-10-04 07:01:03.164490,2026-10-04 07:01:08.357497,0 days 00:00:05.193007,64,small,0.30155612787464464,0.0015585605382544092,0.0006924374358861715,"{""batch_size"": 64, ""channels"": ""small"", ""dropout"": 0.30155612787464464, ""lr"": 0.0015585605382544092, ""weight_decay"": 0.0006924374358861715}",PRUNED
13,0.9887994190377284,2026-10-04 07:01:08.369149,2026-10-04 07:01:26.730694,0 days 00:00:18.361545,32,small,0.2729261255806363,0.0032847858831120615,0.00042623489927173607,"{""batch_size"": 32, ""channels"": ""small"", ""dropout"": 0.2729261255806363, ""lr"": 0.0032847858831120615, ""weight_decay"": 0.00042623489927173607}",COMPLETE
14,0.9101540373883006,2026-10-04 07:01:26.744930,2026-10-04 07:01:32.348130,0 days 00:00:05.603200,32,small,0.31889197085685583,0.0035887186677287073,5.2386549541031695e-05,"{""batch_size"": 32, ""channels"": ""small"", ""dropout"": 0.31889197085685583, ""lr"": 0.0035887186677287073, ""weight_decay"": 5.2386549541031695e-05}",PRUNED
15,0.947533766440928,2026-10-04 07:01:32.359955,2026-10-04 07:01:41.597676,0 days 00:00:09.237721,32,small,0.10938202058261307,0.004205796033835191,0.0015276949391248087,"{""batch_size"": 32, ""channels"": ""small"", ""dropout"": 0.10938202058261307, ""lr"": 0.004205796033835191, ""weight_decay"": 0.0015276949391248087}",PRUNED
16,0.9562033376614496,2026-10-04 07:01:41.609167,2026-10-04 07:01:47.250943,0 days 00:00:05.641776,32,small,0.45314398681682266,0.0006581577463470391,0.0006509205585485525,"{""batch_size"": 32, ""channels"": ""small"", ""dropout"": 0.45314398681682266, ""lr"": 0.0006581577463470391, ""weight_decay"": 0.0006509205585485525}",PRUNED
17,0.7108874132400821,2026-10-04 07:01:47.263595,2026-10-04 07:01:52.879418,0 days 00:00:05.615823,32,small,0.33898155108758676,0.0008294703148365543,0.0007727509465497158,"{""batch_size"": 32, ""channels"": ""small"", ""dropout"": 0.33898155108758676, ""lr"": 0.0008294703148365543, ""weight_decay"": 0.0007727509465497158}",PRUNED
18,0.9397465871238103,2026-10-04 07:01:52.891134,2026-10-04 07:01:58.511577,0 days 00:00:05.620443,32,small,0.11052375275449414,0.0005393137711477325,0.00028485524654488817,"{""batch_size"": 32, ""channels"": ""small"", ""dropout"": 0.11052375275449414, ""lr"": 0.0005393137711477325, ""weight_decay"": 0.00028485524654488817}",PRUNED
19,0.7481151019929719,2026-10-04 07:01:58.525571,2026-10-04 07:02:13.291397,0 days 00:00:14.765826,32,large,0.3221024906486557,0.002182280822685184,0.0003179178574303649,"{""batch_size"": 32, ""channels"": ""large"", ""dropout"": 0.3221024906486557, ""lr"": 0.002182280822685184, ""weight_decay"": 0.0003179178574303649}",PRUNED
20,0.9385752837933594,2026-10-04 07:02:13.303395,2026-10-04 07:02:18.913252,0 days 00:00:05.609857,32,small,0.2124211797912097,0.0033900667599383394,0.0005320002768759661,"{""batch_size"": 32, ""channels"": ""small"", ""dropout"": 0.2124211797912097, ""lr"": 0.0033900667599383394, ""weight_decay"": 0.0005320002768759661}",PRUNED
21,0.9915148158474302,2026-10-04 07:02:18.926004,2026-10-04 07:02:37.374541,0 days 00:00:18.448537,32,small,0.44259864084140865,0.0036633885072249665,9.51700232633483e-05,"{""batch_size"": 32, ""channels"": ""small"", ""dropout"": 0.44259864084140865, ""lr"": 0.0036633885072249665, ""weight_decay"": 9.51700232633483e-05}",COMPLETE
22,0.953662542103982,2026-10-04 07:02:37.391267,2026-10-04 07:02:42.990581,0 days 00:00:05.599314,32,small,0.4498265300309038,0.0030684939367058225,0.0001882952438062227,"{""batch_size"": 32, ""channels"": ""small"", ""dropout"": 0.4498265300309038, ""lr"": 0.0030684939367058225, ""weight_decay"": 0.0001882952438062227}",PRUNED
23,0.9860719762271224,2026-10-04 07:02:43.003137,2026-10-04 07:02:57.772774,0 days 00:00:14.769637,32,small,0.39335447720124833,0.0030291440153279742,6.694566935205916e-06,"{""batch_size"": 32, ""channels"": ""small"", ""dropout"": 0.39335447720124833, ""lr"": 0.0030291440153279742, ""weight_decay"": 6.694566935205916e-06}",PRUNED
24,0.9911715322510899,2026-10-04 07:02:57.784897,2026-10-04 07:03:16.153191,0 days 00:00:18.368294,32,small,0.4371119663086752,0.004839024641445381,0.00037630655033890967,"{""batch_size"": 32, ""channels"": ""small"", ""dropout"": 0.4371119663086752, ""lr"": 0.004839024641445381, ""weight_decay"": 0.00037630655033890967}",COMPLETE
25,0.8498845046851384,2026-10-04 07:03:16.167899,2026-10-04 07:03:21.295049,0 days 00:00:05.127150,128,small,0.4248293081256263,0.001763051019681565,2.3384158219086655e-05,"{""batch_size"": 128, ""channels"": ""small"", ""dropout"": 0.4248293081256263, ""lr"": 0.001763051019681565, ""weight_decay"": 2.3384158219086655e-05}",PRUNED
26,0.942898267651644,2026-10-04 07:03:21.306768,2026-10-04 07:03:26.947593,0 days 00:00:05.640825,32,small,0.4718075194245855,0.002273553193146673,0.0008606732359821857,"{""batch_size"": 32, ""channels"": ""small"", ""dropout"": 0.4718075194245855, ""lr"": 0.002273553193146673, ""weight_decay"": 0.0008606732359821857}",PRUNED
27,0.7938970700316645,2026-10-04 07:03:26.959660,2026-10-04 07:03:32.048094,0 days 00:00:05.088434,128,small,0.49951129969625685,0.004810577526686205,0.000548723703468804,"{""batch_size"": 128, ""channels"": ""small"", ""dropout"": 0.49951129969625685, ""lr"": 0.004810577526686205, ""weight_decay"": 0.000548723703468804}",PRUNED
28,0.931352458738824,2026-10-04 07:03:32.061040,2026-10-04 07:03:37.685878,0 days 00:00:05.624838,32,small,0.3733765969220667,0.0011298647699990814,0.00015143600038467904,"{""batch_size"": 32, ""channels"": ""small"", ""dropout"": 0.3733765969220667, ""lr"": 0.0011298647699990814, ""weight_decay"": 0.00015143600038467904}",PRUNED
29,0.9338754190901444,2026-10-04 07:03:37.698452,2026-10-04 07:03:43.318124,0 days 00:00:05.619672,32,small,0.33901106696188504,0.0025764577145700853,0.004499127544372944,"{""batch_size"": 32, ""channels"": ""small"", ""dropout"": 0.33901106696188504, ""lr"": 0.0025764577145700853, ""weight_decay"": 0.004499127544372944}",PRUNED
