number,value,datetime_start,datetime_complete,duration,params_alpha,params_base_ch,params_batch_size,params_bottleneck,params_dropout,params_latent_ch,params_latent_dim,params_lr,system_attrs_tpe:relative_params:0,state
0,0.5709024295210838,2026-10-04 07:05:52.430957,2026-10-04 07:08:06.458660,0 days 00:02:14.027703,0.8186326600082204,64,32,conv,0.18033450352296262,4.0,,0.0007106591851092234,,COMPLETE
1,0.530086100101471,2026-10-04 07:08:06.479328,2026-10-04 07:08:44.978074,0 days 00:00:38.498746,0.8533291826268561,16,32,conv,0.13682099526511077,16.0,,0.0006044543365247595,,COMPLETE
2,0.49296190589666367,2026-10-04 07:08:44.995859,2026-10-04 07:10:22.602962,0 days 00:01:37.607103,0.7228296095500716,48,64,conv,0.036611470453433645,8.0,,0.00034847597967739357,,COMPLETE
3,0.7258338928222656,2026-10-04 07:10:22.618783,2026-10-04 07:10:33.489082,0 days 00:00:10.870299,0.5881922880886153,16,64,conv,0.02654775061557585,16.0,,0.00105640764164036,,PRUNED
4,0.7709805071353912,2026-10-04 07:10:33.501681,2026-10-04 07:10:51.320031,0 days 00:00:17.818350,0.8669576428046754,32,128,conv,0.0016566351370807197,4.0,,0.0005728695840313613,,PRUNED
5,0.6086729019880295,2026-10-04 07:10:51.331994,2026-10-04 07:11:50.955236,0 days 00:00:59.623242,0.7124967163228771,48,32,conv,0.26616382277289796,16.0,,0.0021888937469133466,,PRUNED
6,0.48588163405656815,2026-10-04 07:11:50.969185,2026-10-04 07:12:52.911546,0 days 00:01:01.942361,0.6121815031169937,32,32,conv,0.2722699421778279,16.0,,0.0009996640726638705,,COMPLETE
7,0.8974383473396301,2026-10-04 07:12:52.929450,2026-10-04 07:13:24.681163,0 days 00:00:31.751713,0.9032410849655719,48,128,linear,0.24223204654921876,,1024.0,0.0025516370943178554,,PRUNED
8,0.6742832660675049,2026-10-04 07:13:24.695637,2026-10-04 07:14:04.646965,0 days 00:00:39.951328,0.81635853150283,48,32,conv,0.1556371865230098,4.0,,0.0003048410053590859,,PRUNED
9,0.8332907855510712,2026-10-04 07:14:04.659584,2026-10-04 07:14:34.863852,0 days 00:00:30.204268,0.7202537421249033,48,64,linear,0.04346846162736693,,256.0,0.0005780451332842859,,PRUNED
10,0.45124729722738266,2026-10-04 07:14:34.876241,2026-10-04 07:15:36.556999,0 days 00:01:01.680758,0.5662463688599269,32,32,conv,0.11526581787119378,32.0,,0.0015380337471164356,"{""alpha"": 0.5662463688599269, ""base_ch"": 32, ""batch_size"": 32, ""bottleneck"": ""conv"", ""dropout"": 0.11526581787119378, ""lr"": 0.0015380337471164356}",COMPLETE
11,0.5702763721346855,2026-10-04 07:15:36.574354,2026-10-04 07:16:07.339033,0 days 00:00:30.764679,0.6652243486123547,32,32,conv,0.1705170189786942,32.0,,0.0017789440569363718,"{""alpha"": 0.6652243486123547, ""base_ch"": 32, ""batch_size"": 32, ""bottleneck"": ""conv"", ""dropout"": 0.1705170189786942, ""lr"": 0.0017789440569363718}",PRUNED
12,0.7229645103216171,2026-10-04 07:16:07.350470,2026-10-04 07:16:18.986639,0 days 00:00:11.636169,0.6331846318932259,16,32,conv,0.2578695826416797,32.0,,0.000870485793094218,"{""alpha"": 0.6331846318932259, ""base_ch"": 16, ""batch_size"": 32, ""bottleneck"": ""conv"", ""dropout"": 0.2578695826416797, ""lr"": 0.000870485793094218}",PRUNED
13,0.4288916140794754,2026-10-04 07:16:18.998717,2026-10-04 07:17:58.557516,0 days 00:01:39.558799,0.5488201395303574,48,32,conv,0.10084314710037118,32.0,,0.0009274604617451832,"{""alpha"": 0.5488201395303574, ""base_ch"": 48, ""batch_size"": 32, ""bottleneck"": ""conv"", ""dropout"": 0.10084314710037118, ""lr"": 0.0009274604617451832}",COMPLETE
14,0.6022800505161285,2026-10-04 07:17:58.579571,2026-10-04 07:18:23.327965,0 days 00:00:24.748394,0.5570017784062707,32,32,conv,0.11100943819660868,32.0,,0.0028053898695169074,"{""alpha"": 0.5570017784062707, ""base_ch"": 32, ""batch_size"": 32, ""bottleneck"": ""conv"", ""dropout"": 0.11100943819660868, ""lr"": 0.0028053898695169074}",PRUNED
15,0.4261483997106552,2026-10-04 07:18:23.339530,2026-10-04 07:20:02.442223,0 days 00:01:39.102693,0.5136999065389088,48,32,conv,0.10058653627072628,32.0,,0.0007739720850176257,"{""alpha"": 0.5136999065389088, ""base_ch"": 48, ""batch_size"": 32, ""bottleneck"": ""conv"", ""dropout"": 0.10058653627072628, ""lr"": 0.0007739720850176257}",COMPLETE
16,0.42051033675670624,2026-10-04 07:20:02.458816,2026-10-04 07:21:41.718350,0 days 00:01:39.259534,0.6251800358670697,48,32,conv,0.04376913255903388,32.0,,0.0013667614251117758,"{""alpha"": 0.6251800358670697, ""base_ch"": 48, ""batch_size"": 32, ""bottleneck"": ""conv"", ""dropout"": 0.04376913255903388, ""lr"": 0.0013667614251117758}",COMPLETE
17,0.5996208935976028,2026-10-04 07:21:41.735177,2026-10-04 07:22:21.520672,0 days 00:00:39.785495,0.6582127559203824,48,32,conv,0.07364337737424427,8.0,,0.0008313816512065335,"{""alpha"": 0.6582127559203824, ""base_ch"": 48, ""batch_size"": 32, ""bottleneck"": ""conv"", ""dropout"": 0.07364337737424427, ""lr"": 0.0008313816512065335}",PRUNED
18,0.5540007129311562,2026-10-04 07:22:21.534096,2026-10-04 07:23:21.132595,0 days 00:00:59.598499,0.6844544116731704,48,32,conv,0.10802686039648005,32.0,,0.001838222816032138,"{""alpha"": 0.6844544116731704, ""base_ch"": 48, ""batch_size"": 32, ""bottleneck"": ""conv"", ""dropout"": 0.10802686039648005, ""lr"": 0.001838222816032138}",PRUNED
19,0.5897360891103745,2026-10-04 07:23:21.146766,2026-10-04 07:24:00.960036,0 days 00:00:39.813270,0.5104982063886646,48,32,conv,0.15740818072956714,32.0,,0.0005912871256597554,"{""alpha"": 0.5104982063886646, ""base_ch"": 48, ""batch_size"": 32, ""bottleneck"": ""conv"", ""dropout"": 0.15740818072956714, ""lr"": 0.0005912871256597554}",PRUNED
20,0.659691110253334,2026-10-04 07:24:00.976101,2026-10-04 07:24:30.816210,0 days 00:00:29.840109,0.6480600613975755,48,32,conv,0.03678318502583772,32.0,,0.0024936987460455417,"{""alpha"": 0.6480600613975755, ""base_ch"": 48, ""batch_size"": 32, ""bottleneck"": ""conv"", ""dropout"": 0.03678318502583772, ""lr"": 0.0024936987460455417}",PRUNED
21,0.42819028347730637,2026-10-04 07:24:30.828442,2026-10-04 07:26:10.354134,0 days 00:01:39.525692,0.5636236246854722,48,32,conv,0.025809801779265673,32.0,,0.0010436148589998333,"{""alpha"": 0.5636236246854722, ""base_ch"": 48, ""batch_size"": 32, ""bottleneck"": ""conv"", ""dropout"": 0.025809801779265673, ""lr"": 0.0010436148589998333}",COMPLETE
22,0.6525823175907135,2026-10-04 07:26:10.369574,2026-10-04 07:26:40.391840,0 days 00:00:30.022266,0.508641798161825,48,32,conv,0.029798350080386653,32.0,,0.0016214452654041357,"{""alpha"": 0.508641798161825, ""base_ch"": 48, ""batch_size"": 32, ""bottleneck"": ""conv"", ""dropout"": 0.029798350080386653, ""lr"": 0.0016214452654041357}",PRUNED
23,0.9166782200336456,2026-10-04 07:26:40.405046,2026-10-04 07:27:10.433561,0 days 00:00:30.028515,0.5774578038107049,48,128,linear,0.030504510382371446,,512.0,0.0013649965400237623,"{""alpha"": 0.5774578038107049, ""base_ch"": 48, ""batch_size"": 128, ""bottleneck"": ""linear"", ""dropout"": 0.030504510382371446, ""lr"": 0.0013649965400237623}",PRUNED
24,0.4412962570786476,2026-10-04 07:27:10.445601,2026-10-04 07:28:49.582656,0 days 00:01:39.137055,0.5949390958188909,48,32,conv,0.12326595680577998,32.0,,0.0004159669720466171,"{""alpha"": 0.5949390958188909, ""base_ch"": 48, ""batch_size"": 32, ""bottleneck"": ""conv"", ""dropout"": 0.12326595680577998, ""lr"": 0.0004159669720466171}",COMPLETE
25,0.7463596314191818,2026-10-04 07:28:49.596967,2026-10-04 07:29:19.266951,0 days 00:00:29.669984,0.5657688972734964,48,32,conv,0.01241821421310215,8.0,,0.0029844557759890096,"{""alpha"": 0.5657688972734964, ""base_ch"": 48, ""batch_size"": 32, ""bottleneck"": ""conv"", ""dropout"": 0.01241821421310215, ""lr"": 0.0029844557759890096}",PRUNED
26,0.9375558793544769,2026-10-04 07:29:19.279599,2026-10-04 07:29:47.919968,0 days 00:00:28.640369,0.5287823945970531,48,128,conv,0.08254308832926574,32.0,,0.0006918337683480276,"{""alpha"": 0.5287823945970531, ""base_ch"": 48, ""batch_size"": 128, ""bottleneck"": ""conv"", ""dropout"": 0.08254308832926574, ""lr"": 0.0006918337683480276}",PRUNED
27,0.6629331856966019,2026-10-04 07:29:47.931099,2026-10-04 07:30:17.683875,0 days 00:00:29.752776,0.7629102442024472,48,32,conv,0.06992670552260971,32.0,,0.001093563149118775,"{""alpha"": 0.7629102442024472, ""base_ch"": 48, ""batch_size"": 32, ""bottleneck"": ""conv"", ""dropout"": 0.06992670552260971, ""lr"": 0.001093563149118775}",PRUNED
28,0.635650672018528,2026-10-04 07:30:17.695876,2026-10-04 07:30:47.339402,0 days 00:00:29.643526,0.5172796020567623,48,32,conv,0.06839567810318678,32.0,,0.0012514949427998342,"{""alpha"": 0.5172796020567623, ""base_ch"": 48, ""batch_size"": 32, ""bottleneck"": ""conv"", ""dropout"": 0.06839567810318678, ""lr"": 0.0012514949427998342}",PRUNED
29,0.7814104408025742,2026-10-04 07:30:47.351982,2026-10-04 07:31:17.615180,0 days 00:00:30.263198,0.5215287869019691,48,32,linear,0.0022834730581400633,,128.0,0.0008772358308719123,"{""alpha"": 0.5215287869019691, ""base_ch"": 48, ""batch_size"": 32, ""bottleneck"": ""linear"", ""dropout"": 0.0022834730581400633, ""lr"": 0.0008772358308719123}",PRUNED
